{
  "log": "cases/occur_rec/logs/log4",
  "n": 100,
  "slices": ["typing", "occur_rec"],
  "retry": 3,
  "with_filesize": false,
  "with_test": false,
  "switches": ["5.3.0+occur_rec_profiling", "5.3.0+occur_rec_marking"],
  "context": [],
  "pkgs": [
    {"name": "ocamlbuild", "version": "0.16.1"},
    {"name": "uchar", "version": "0.0.2"},
    {"name": "topkg", "version": "1.0.8"},
    {"name": "uutf", "version": "1.0.4"},
    {"name": "react", "version": "1.2.2"},
    {"name": "dune", "version": "3.17.2"},
    {"name": "trie", "version": "1.0.0"},
    {"name": "result", "version": "1.5"},
    {"name": "either", "version": "1.0.0"},
    {"name": "csexp", "version": "1.5.2"},
    {"name": "ocaml_intrinsics_kernel", "version": "v0.17.1"},
    {"name": "sexplib0", "version": "v0.17.0"},
    {"name": "mew", "version": "0.1.0"},
    {"name": "xdg", "version": "3.17.2"},
    {"name": "cppo", "version": "1.8.0"},
    {"name": "mew_vi", "version": "0.5.0"},
    {"name": "ocplib-endian", "version": "1.2"},
    {"name": "dune-configurator", "version": "3.17.2"},
    {"name": "containers", "version": "3.15"},
    {"name": "lwt", "version": "5.9.1"},
    {"name": "lwt_react", "version": "1.2.0"},
    {"name": "logs", "version": "0.8.0"},
    {"name": "base", "version": "v0.17.1"},
    {"name": "uucp", "version": "16.0.0"},
    {"name": "uuseg", "version": "16.0.0"},
    {"name": "zed", "version": "3.2.3"},
    {"name": "lambda-term", "version": "3.3.2"},
    {"name": "utop", "version": "2.15.0-1"},
    {"name": "seq", "version": "base"},
    {"name": "re", "version": "1.12.0"},
    {"name": "tyxml", "version": "4.6.0"},
    {"name": "fieldslib", "version": "v0.17.0"},
    {"name": "jane-street-headers", "version": "v0.17.0"},
    {"name": "ppx_derivers", "version": "1.2.1"},
    {"name": "stdlib-shims", "version": "0.3.0"},
    {"name": "variantslib", "version": "v0.17.0"},
    {"name": "stdio", "version": "v0.17.0"},
    {"name": "ocaml-compiler-libs", "version": "v0.17.0"},
    {"name": "typerep", "version": "v0.17.1"},
    {"name": "parsexp", "version": "v0.17.0"},
    {"name": "sexplib", "version": "v0.17.0"},
    {"name": "ppxlib", "version": "0.35.0"},
    {"name": "ppxlib_jane", "version": "v0.17.2"},
    {"name": "ppx_optcomp", "version": "v0.17.0"},
    {"name": "ppx_tydi", "version": "v0.17.0"},
    {"name": "ppx_disable_unused_warnings", "version": "v0.17.0"},
    {"name": "ppx_cold", "version": "v0.17.0"},
    {"name": "ppx_stable_witness", "version": "v0.17.0"},
    {"name": "ppx_here", "version": "v0.17.0"},
    {"name": "ppx_variants_conv", "version": "v0.17.0"},
    {"name": "ppx_typerep_conv", "version": "v0.17.0"},
    {"name": "ppx_stable", "version": "v0.17.0"},
    {"name": "ppx_ignore_instrumentation", "version": "v0.17.0"},
    {"name": "ppx_fixed_literal", "version": "v0.17.0"},
    {"name": "ppx_fields_conv", "version": "v0.17.0"},
    {"name": "ppx_pipebang", "version": "v0.17.0"},
    {"name": "ppx_enumerate", "version": "v0.17.0"},
    {"name": "ppx_globalize", "version": "v0.17.0"},
    {"name": "ppx_compare", "version": "v0.17.0"},
    {"name": "ppx_optional", "version": "v0.17.0"},
    {"name": "ppx_sexp_conv", "version": "v0.17.0"},
    {"name": "ppx_let", "version": "v0.17.0"},
    {"name": "ppx_hash", "version": "v0.17.0"},
    {"name": "ppx_assert", "version": "v0.17.0"},
    {"name": "ppx_sexp_value", "version": "v0.17.0"},
    {"name": "ppx_sexp_message", "version": "v0.17.0"},
    {"name": "ppx_custom_printf", "version": "v0.17.0"},
    {"name": "ppx_base", "version": "v0.17.0"},
    {"name": "capitalization", "version": "v0.17.0"},
    {"name": "jst-config", "version": "v0.17.0"},
    {"name": "ppx_string", "version": "v0.17.0"},
    {"name": "bin_prot", "version": "v0.17.0"},
    {"name": "time_now", "version": "v0.17.0"},
    {"name": "ppx_string_conv", "version": "v0.17.0"},
    {"name": "ppx_bin_prot", "version": "v0.17.0"},
    {"name": "ppx_module_timer", "version": "v0.17.0"},
    {"name": "ppx_inline_test", "version": "v0.17.0"},
    {"name": "ppx_bench", "version": "v0.17.0"},
    {"name": "ppx_expect", "version": "v0.17.2"},
    {"name": "splittable_random", "version": "v0.17.0"},
    {"name": "ppx_log", "version": "v0.17.0"},
    {"name": "base_quickcheck", "version": "v0.17.0"},
    {"name": "ppx_jane", "version": "v0.17.0"},
    {"name": "uopt", "version": "v0.17.0"},
    {"name": "gel", "version": "v0.17.0"},
    {"name": "int_repr", "version": "v0.17.0"},
    {"name": "base_bigstring", "version": "v0.17.0"},
    {"name": "ppx_diff", "version": "v0.17.0"},
    {"name": "core", "version": "v0.17.1"},
    {"name": "janestreet_lru_cache", "version": "v0.17.0"},
    {"name": "core_kernel", "version": "v0.17.0"},
    {"name": "incremental", "version": "v0.17.0"}
  ],
  "status_file": "cases/occur_rec/status/run4"
}